{
  "domain_id": "insurance",
  "display_name": "Insurance",
  "coverage": {
    "discover_url": "${INSURANCE_COVERAGE_URL}/coverage/{principal_id}",
    "check_url": "${INSURANCE_COVERAGE_URL}/coverage/{principal_id}/resources/{id}",
    "resolve_url": "${INSURANCE_COVERAGE_URL}/entities/resolve",
    "cache_ttl_seconds": 30
  },
  "memory_compaction": {
    "envelope_version": "context-envelope.v1",
    "must_preserve": ["policy_id", "claim_id", "period", "domain"],
    "can_drop": ["raw_agent_outputs", "routing_decisions"],
    "summary_policy": {
      "owner": "memory-service",
      "max_summary_tokens": 600,
      "refresh_after_turns": 8,
      "ledger_retention_days": 90,
      "include_runtime_events": [
        "gateway.entity_resolved",
        "gateway.coverage_checked",
        "gateway.agent_completed",
        "gateway.response_completed"
      ],
      "redact_fields": ["raw_agent_outputs"]
    }
  }
}
